{
  "schemaVersion": "1.0",
  "templateId": "signal-ledger",
  "design": {
    "origin": "original"
  },
  "resources": [
    {
      "path": "fonts/bricolage-grotesque-latin-standard-normal.woff2",
      "kind": "font",
      "origin": "third-party",
      "sourceName": "Bricolage Grotesque",
      "sourceUrl": "https://github.com/ateliertriay/bricolage",
      "sourceVersion": "v9",
      "license": "OFL-1.1",
      "copyright": "Copyright 2022 The Bricolage Grotesque Project Authors",
      "licensePath": "licenses/bricolage-grotesque-OFL-1.1.txt"
    },
    {
      "path": "fonts/geist-latin-wght-normal.woff2",
      "kind": "font",
      "origin": "third-party",
      "sourceName": "Geist",
      "sourceUrl": "https://github.com/vercel/geist-font",
      "sourceVersion": "v5",
      "license": "OFL-1.1",
      "copyright": "Copyright 2024 The Geist Project Authors",
      "licensePath": "licenses/geist-OFL-1.1.txt"
    }
  ]
}
